{
  "$schema": "./resume.schema.json",
  "meta": {
    "name": "Luke‑Angelo Strazzera",
    "title": "Software Engineer",
    "tagline": "AI · Cloud · Full-Stack Engineering",
    "summary": "AI Engineer who designs and delivers secure, production-grade systems end to end, with a focus on solutions architecture. Went from intern to team lead in under two years. Passionate about guiding customers through complex technical decisions and workflows, translating business requirements into scalable architectures, and helping organizations adopt new workloads and solutions with confidence.",
    "role": "AI Engineer",
    "email": "lukestrazzera@gmail.com",
    "website": "https://luke-angelo.com",
    "github": "LukeStrazz",
    "githubUrl": "https://github.com/LukeStrazz",
    "viewCounterId": "yLukeStrazz",
    "linkedin": "https://www.linkedin.com/in/luke-angelo-strazzera-83b7171b4"
  },
  "quickFacts": [
    {
      "label": "Focus",
      "value": "AI governance, secure systems, cloud delivery, full-stack"
    },
    {
      "label": "Trajectory",
      "value": "Intern to team lead in under two years, now AI engineer"
    }
  ],
  "capabilities": [
    {
      "title": "Full-stack delivery",
      "text": "Production work across C#, .NET, React, JavaScript, TypeScript, SQL, and REST APIs, with a strong emphasis on stable releases and maintainable code."
    },
    {
      "title": "AI and automation",
      "text": "Hands-on delivery with Azure OpenAI, the OpenAI API, prompt engineering, GitHub Copilot, and agent-assisted workflows for internal and customer-facing tools."
    },
    {
      "title": "Cloud and identity",
      "text": "Azure and AWS experience spanning Entra ID, Azure AD B2C, app registrations, Blob Storage, Data Factory, EC2, S3, IAM, and CloudFront."
    },
    {
      "title": "Team execution",
      "text": "Comfortable owning architecture, configuration, deployment, debugging, documentation, and stakeholder communication from kickoff through release."
    }
  ],
  "skillGroups": [
    {
      "title": "Languages & Frameworks",
      "items": [
        "Go",
        "C#",
        ".NET",
        "TypeScript",
        "JavaScript",
        "React",
        "Vue",
        "PostgreSQL",
        "SQL",
        "C++",
        "Echo",
        "Material UI"
      ]
    },
    {
      "title": "AI & Automation",
      "items": [
        "Azure OpenAI",
        "OpenAI API",
        "Codex",
        "AI Agents",
        "Model Context Protocol (MCP)",
        "Prompt Engineering",
        "GitHub Copilot",
        "AI Governance & Policy"
      ]
    },
    {
      "title": "Cloud & DevOps",
      "items": [
        "AWS: ECS, ECR, EC2, S3, IAM, VPC, ALB, SES, CloudFront",
        "CloudWatch",
        "Microsoft Azure",
        "Entra ID & Azure AD B2C",
        "Azure Blob Storage & Data Factory",
        "Terraform (IaC)",
        "Docker",
        "GitHub Actions",
        "Azure DevOps",
        "CI/CD Pipelines"
      ]
    },
    {
      "title": "Security & Architecture",
      "items": [
        "API Design & REST",
        "RBAC & Authorization",
        "OIDC / CAIA Authentication",
        "Cloud Identity & Access Management",
        "Secure Application Development",
        "Data Privacy & PII Protection",
        "SQL Optimization & Reporting",
        "CSV/PDF Report Generation",
        "Accessibility (Section 508 / WCAG)"
      ]
    },
    {
      "title": "Testing & Workflow",
      "items": [
        "Unit, Integration & E2E Testing",
        "Release Integration",
        "Operational Runbooks",
        "Agile Development",
        "Git & GitHub",
        "Jira & Confluence",
        "Visual Studio"
      ]
    }
  ],
  "experience": [
    {
      "company": "U.S. Department of the Treasury — TCSC",
      "role": "AI Engineer",
      "dates": "Aug 2026 — Present",
      "points": [
        "Build and ship full-stack features across multiple applications in Go, TypeScript, React, Vue, and SQL, from API and data-layer design through the interfaces people use.",
        "Design and optimize complex PostgreSQL queries for reporting and analytics, with timezone-aware date windows, repeatable-read consistency, scoped access, and CSV/PDF export.",
        "Implement RBAC, CAIA/OIDC authentication, data isolation, and audit controls so every user reaches only the data they are permitted to; hardened exports against spreadsheet formula injection.",
        "Maintain AWS infrastructure in Terraform across ECS, ECR, SES, CloudFront, ALB, IAM, and private networking, and supported a migration to new managed AWS infrastructure.",
        "Accelerate delivery with Codex, GitHub Copilot, and AI agent workflows, and ship through GitHub Actions CI/CD backed by unit, integration, accessibility, and browser-based regression testing."
      ]
    },
    {
      "company": "Saberin Software",
      "role": "Developer Team Lead",
      "dates": "Apr 2025 — Aug 2026",
      "points": [
        "Led production development for .NET applications, reviewing code for quality, security, performance, and long-term maintainability.",
        "Designed and shipped AI-powered features with Azure OpenAI for both internal workflows and customer-facing experiences.",
        "Owned Azure delivery across subscriptions, Entra ID, Azure AD B2C, app registrations, Blob Storage, and Data Factory."
      ]
    },
    {
      "company": "Saberin Software",
      "role": "Junior Software Developer",
      "dates": "Dec 2024 — Apr 2025",
      "points": [
        "Built and deployed cloud-hosted applications across Azure and AWS, including EC2, S3, IAM, CloudFront, and Azure storage services.",
        "Maintained YAML-based CI/CD pipelines in Azure DevOps and GitHub Actions to support repeatable deployments.",
        "Delivered application features across APIs, configuration, and debugging workflows while collaborating directly with stakeholders."
      ]
    },
    {
      "company": "Saberin Software",
      "role": "Entry Level Developer",
      "dates": "Aug 2023 — Dec 2024",
      "points": [
        "Used GitHub Copilot and AI agent workflows to accelerate implementation, documentation, and troubleshooting without lowering code quality.",
        "Contributed to React and .NET application work, API integrations, SQL-backed flows, and production issue resolution.",
        "Grew from task execution into feature ownership while balancing software delivery with a full academic schedule."
      ]
    },
    {
      "company": "Saberin Software",
      "role": "Software Developer Intern",
      "dates": "May 2023 — Aug 2023",
      "points": [
        "Started on hands-on production work, focused on debugging, secure development practices, and reliability.",
        "Worked inside established engineering workflows using Git, Visual Studio, Jira, Confluence, and team documentation standards."
      ]
    }
  ],
  "projects": [
    {
      "title": "StrazzTunedBuddy",
      "label": "Open-source hardware · 105★",
      "text": "An Arduino driving companion with procedurally drawn expressions on a 128x64 OLED — the most-starred and most-forked project on my GitHub.",
      "repo": "https://github.com/LukeStrazz/StrazzTunedBuddy",
      "page": "/projects/strazztunedbuddy/",
      "image": "/assets/projects/cards/strazztunedbuddy.jpg"
    },
    {
      "title": "VitalVues",
      "label": "OpenAI application",
      "text": "A senior capstone that explains bloodwork results in plain language, then builds diet and workout guidance from the user's own markers.",
      "repo": "https://github.com/LukeStrazz/VitalVues",
      "page": "/projects/vitalvues/",
      "image": "/assets/projects/cards/vitalvues.png"
    },
    {
      "title": "WHIM",
      "label": "Private · .NET 9 product",
      "text": "A clean-architecture .NET 9 solution with PostgreSQL, containerised services, and cross-platform mobile clients.",
      "page": "/projects/whim/",
      "image": "/assets/projects/cards/whim.svg"
    },
    {
      "title": "Strazz Robinhood MCP",
      "label": "Private · MCP server",
      "text": "A Model Context Protocol server exposing brokerage research and risk-managed, paper-trading-by-default execution to AI clients.",
      "page": "/projects/strazz-robinhood-mcp/",
      "image": "/assets/projects/cards/strazz-robinhood-mcp.svg"
    },
    {
      "title": "Saberin Software",
      "label": "Production delivery",
      "text": "Secure .NET delivery, AI integration, cloud identity work, team leadership, and shipping features that hold up in production.",
      "image": "/assets/projects/cards/saberin.png"
    }
  ],
  "education": [
    {
      "school": "Farmingdale State College",
      "degree": "B.S. in Computer Science",
      "dates": "Completed January 2025",
      "details": [
        "3.65 GPA",
        "President's List 2023",
        "Dean's List 2023 – 2024"
      ]
    }
  ],
  "supportingSignals": [
    "B.S. in Computer Science from Farmingdale State College, completed January 2025 with a 3.65 GPA.",
    "President's List 2023 and Dean's List 2023 to 2024.",
    "Strong communicator with experience translating technical work for stakeholders, teammates, and clients.",
    "Built professional discipline in high-pressure service roles before moving full-time into software."
  ],
  "workingStyle": [
    "Agile development",
    "Client communication",
    "Technical documentation",
    "Mentorship",
    "Cross-functional teamwork",
    "Production debugging"
  ],
  "techBadges": {
    "Platforms & Tools": [
      {
        "name": "PostgreSQL",
        "color": "4169E1",
        "logo": "postgresql"
      },
      {
        "name": "Microsoft SQL Server",
        "color": "CC2927",
        "logo": "microsoft%20sql%20server"
      },
      {
        "name": "Figma",
        "color": "F24E1E",
        "logo": "figma"
      },
      {
        "name": "Jira",
        "color": "0A0FFF",